{"advance_ordinal":1,"durable_state_sha256":"sha256:1111111111111111111111111111111111111111111111111111111111111111","release_identity_id":"sha256:3d52af3a2bc6eb185a48465c8680d988a57f7fecf668313673ded1aaed3a59ab","retry_after_seconds":5,"schema":"dpone.release-controller-draft-advance-response.v1","schema_version":1,"status":"IN_PROGRESS","tag":"v0.74.0"}